{
  "$schema": "https://json-schema.org/draft/2020-12/schema",
  "$id": "https://aicte.gov.in/schemas/v4/validation_response.schema.json",
  "title": "Validation Report Response",
  "description": "Validation response returned by GET /api/demo/applications/{application_id}/validate (Guide §1.3, §16).",
  "type": "object",
  "required": [
    "application_id",
    "category",
    "workflow",
    "decision_support_only",
    "simulated",
    "rule_set",
    "rule_set_version",
    "coverage",
    "checks",
    "findings"
  ],
  "properties": {
    "application_id": {
      "type": "string",
      "description": "Unique identifier of the application evaluated"
    },
    "category": {
      "type": "string",
      "description": "Application approval category (e.g. EOA_RENEWAL, INCREASE_INTAKE, NEW_INSTITUTE)"
    },
    "workflow": {
      "type": "string",
      "enum": [
        "NO_FINDINGS_IN_ENABLED_DEMO_CHECKS",
        "NEEDS_RECTIFICATION",
        "NEEDS_MANUAL_REVIEW",
        "VALIDATED_NO_ISSUES",
        "DRAFT",
        "SUBMITTED",
        "VALIDATING",
        "UNDER_OFFICER_REVIEW",
        "OFFICER_DECISION_RECORDED"
      ],
      "description": "Application workflow status dimension. VALIDATED_NO_ISSUES is restricted to complete passes of the full active rule set, full issuer verifications, and OCR quality gates; partial demo runs must use scoped statuses like NO_FINDINGS_IN_ENABLED_DEMO_CHECKS."
    },
    "decision_support_only": {
      "type": "boolean",
      "const": true,
      "description": "Always true. The prototype informs officers; it never issues approvals or sanctions."
    },
    "simulated": {
      "type": "boolean",
      "const": true,
      "description": "Always true for synthetic fixtures and demo environments."
    },
    "rule_set": {
      "type": "string",
      "description": "Identifier of the rule checklist applied (e.g. EOA_RENEWAL-demo-v1)"
    },
    "rule_set_version": {
      "type": "string",
      "description": "Version string of the rule set applied (e.g. 1.0.0)"
    },
    "coverage": {
      "type": "object",
      "required": ["mode", "summary", "rules_evaluated", "checks_not_evaluated"],
      "properties": {
        "mode": {
          "type": "string",
          "enum": ["demo_partial_checks", "full_handbook_checklist"]
        },
        "summary": { "type": "string" },
        "rules_evaluated": { "type": "integer", "minimum": 0 },
        "checks_not_evaluated": {
          "type": "array",
          "items": { "type": "string" },
          "description": "List of pipeline capabilities or handbook areas not covered in this evaluation"
        }
      }
    },
    "checks": {
      "type": "array",
      "items": {
        "$ref": "c4_check_result.schema.json"
      },
      "description": "List of evaluated check results"
    },
    "findings": {
      "type": "array",
      "items": {
        "$ref": "c5_finding.schema.json"
      },
      "description": "List of actionable findings or discrepancy indicators"
    }
  }
}
